{
 "batch": "ledger-verdicts-001",
 "generated_at": "2026-09-04T19:31:14.763392Z",
 "prompt_version": "sha256:70ca104246d8bb95",
 "classified_by": "session-haiku",
 "source_export_ref": "ledger-consume/33908401816 (candidates-33908401816.json, --with-text, 400 rows: 338 with text, 62 below the 200-char floor); PRUNED 2026-09-04 by the coordinator after lane LEDGER-WALLS shipped detectAccessWall: 308 of the 338 classified texts were access-wall shells (request_access 231, eurlex_interface_shell 76, browser_not_supported 1) — a verdict rated from a shell is not a rating of the source (CLAUDE.md rule 18), so those 308 entries (incl. all 63 specific_document verdicts, every one an EUR-Lex chrome+title shell) were removed and their candidates go back through the API/HTML transports for re-export and re-classification as batch 002. The 30 entries kept are portal verdicts over real page text.",
 "entries": [
  {
   "candidate_id": "270b6eb5-de28-447a-ba93-853d0ce37426",
   "url": "https://eur-lex.europa.eu/collection/eu-law/treaties/treaties-force.html",
   "entity_verdict": "portal",
   "item_type": null,
   "domain": null,
   "surface_tags": [],
   "relevance": null,
   "severity": null,
   "priority": null,
   "urgency_tier": null,
   "topic_tags": [],
   "jurisdictions": [],
   "title_candidate": "EUR-Lex",
   "summary": "Treaties currently in force - EUR-Lex &times; Skip to main content Log in My EUR-Lex My EUR-Lex Sign in Register My recent searches (0) English English Select your language Official EU languages: bg б",
   "rationale": "Page is a navigational portal, homepage, or institution landing page rather than a specific regulatory document.",
   "confidence": 0.85,
   "classified_by": "session-haiku",
   "classified_at": "2026-09-04T19:26:12.340Z",
   "prompt_version": "sha256:70ca104246d8bb95"
  },
  {
   "candidate_id": "b3a8cb9f-e07e-4478-b864-2ee1a7090f2d",
   "url": "https://eur-lex.europa.eu/collection/eu-law/treaties/treaties-founding.html",
   "entity_verdict": "portal",
   "item_type": null,
   "domain": null,
   "surface_tags": [],
   "relevance": null,
   "severity": null,
   "priority": null,
   "urgency_tier": null,
   "topic_tags": [],
   "jurisdictions": [],
   "title_candidate": "EUR-Lex",
   "summary": "Founding Treaties - EUR-Lex &times; Skip to main content Log in My EUR-Lex My EUR-Lex Sign in Register My recent searches (0) English English Select your language Official EU languages: bg български e",
   "rationale": "Page is a navigational portal, homepage, or institution landing page rather than a specific regulatory document.",
   "confidence": 0.85,
   "classified_by": "session-haiku",
   "classified_at": "2026-09-04T19:26:12.340Z",
   "prompt_version": "sha256:70ca104246d8bb95"
  },
  {
   "candidate_id": "43691796-edbc-436f-8711-3c8b826a7168",
   "url": "https://eur-lex.europa.eu/collection/eu-law/treaties/treaties-accession.html",
   "entity_verdict": "portal",
   "item_type": null,
   "domain": null,
   "surface_tags": [],
   "relevance": null,
   "severity": null,
   "priority": null,
   "urgency_tier": null,
   "topic_tags": [],
   "jurisdictions": [],
   "title_candidate": "EUR-Lex",
   "summary": "Accession Treaties - EUR-Lex &times; Skip to main content Log in My EUR-Lex My EUR-Lex Sign in Register My recent searches (0) English English Select your language Official EU languages: bg български ",
   "rationale": "Page is a navigational portal, homepage, or institution landing page rather than a specific regulatory document.",
   "confidence": 0.85,
   "classified_by": "session-haiku",
   "classified_at": "2026-09-04T19:26:12.340Z",
   "prompt_version": "sha256:70ca104246d8bb95"
  },
  {
   "candidate_id": "619e0711-d35c-4eef-b1af-d012978649cd",
   "url": "https://eur-lex.europa.eu/collection/eu-law/treaties/treaties-other.html",
   "entity_verdict": "portal",
   "item_type": null,
   "domain": null,
   "surface_tags": [],
   "relevance": null,
   "severity": null,
   "priority": null,
   "urgency_tier": null,
   "topic_tags": [],
   "jurisdictions": [],
   "title_candidate": "EUR-Lex",
   "summary": "Other treaties and protocols - EUR-Lex &times; Skip to main content Log in My EUR-Lex My EUR-Lex Sign in Register My recent searches (0) English English Select your language Official EU languages: bg ",
   "rationale": "Page is a navigational portal, homepage, or institution landing page rather than a specific regulatory document.",
   "confidence": 0.85,
   "classified_by": "session-haiku",
   "classified_at": "2026-09-04T19:26:12.340Z",
   "prompt_version": "sha256:70ca104246d8bb95"
  },
  {
   "candidate_id": "1b96cb61-48ca-4fd1-9a15-5a19abe5fb49",
   "url": "https://eur-lex.europa.eu/collection/eu-law/treaties/treaties-overview.html",
   "entity_verdict": "portal",
   "item_type": null,
   "domain": null,
   "surface_tags": [],
   "relevance": null,
   "severity": null,
   "priority": null,
   "urgency_tier": null,
   "topic_tags": [],
   "jurisdictions": [],
   "title_candidate": "EUR-Lex",
   "summary": "Chronological overview - EUR-Lex &times; Skip to main content Log in My EUR-Lex My EUR-Lex Sign in Register My recent searches (0) English English Select your language Official EU languages: bg българ",
   "rationale": "Page is a navigational portal, homepage, or institution landing page rather than a specific regulatory document.",
   "confidence": 0.85,
   "classified_by": "session-haiku",
   "classified_at": "2026-09-04T19:26:12.340Z",
   "prompt_version": "sha256:70ca104246d8bb95"
  },
  {
   "candidate_id": "e9632bcc-d1e3-4f3e-9717-cf93207b4562",
   "url": "https://eur-lex.europa.eu/collection/eu-law/legal-acts/recent.html",
   "entity_verdict": "portal",
   "item_type": null,
   "domain": null,
   "surface_tags": [],
   "relevance": null,
   "severity": null,
   "priority": null,
   "urgency_tier": null,
   "topic_tags": [],
   "jurisdictions": [],
   "title_candidate": "EUR-Lex",
   "summary": "Legal acts - EUR-Lex &times; Skip to main content Log in My EUR-Lex My EUR-Lex Sign in Register My recent searches (0) English English Select your language Official EU languages: bg български es Españ",
   "rationale": "Page is a navigational portal, homepage, or institution landing page rather than a specific regulatory document.",
   "confidence": 0.85,
   "classified_by": "session-haiku",
   "classified_at": "2026-09-04T19:26:12.340Z",
   "prompt_version": "sha256:70ca104246d8bb95"
  },
  {
   "candidate_id": "6f071242-0e8c-49f4-bd97-bb178245b042",
   "url": "https://eur-lex.europa.eu/collection/eu-law/consleg.html",
   "entity_verdict": "portal",
   "item_type": null,
   "domain": null,
   "surface_tags": [],
   "relevance": null,
   "severity": null,
   "priority": null,
   "urgency_tier": null,
   "topic_tags": [],
   "jurisdictions": [],
   "title_candidate": "EUR-Lex",
   "summary": "Consolidated texts - EUR-Lex &times; Skip to main content Log in My EUR-Lex My EUR-Lex Sign in Register My recent searches (0) English English Select your language Official EU languages: bg български ",
   "rationale": "Page is a navigational portal, homepage, or institution landing page rather than a specific regulatory document.",
   "confidence": 0.85,
   "classified_by": "session-haiku",
   "classified_at": "2026-09-04T19:26:12.340Z",
   "prompt_version": "sha256:70ca104246d8bb95"
  },
  {
   "candidate_id": "e8520ec4-486d-4ce6-a7d5-c221532d4e15",
   "url": "https://eur-lex.europa.eu/collection/eu-law/inter-agree.html",
   "entity_verdict": "portal",
   "item_type": null,
   "domain": null,
   "surface_tags": [],
   "relevance": null,
   "severity": null,
   "priority": null,
   "urgency_tier": null,
   "topic_tags": [],
   "jurisdictions": [],
   "title_candidate": "EUR-Lex",
   "summary": "International agreements - EUR-Lex &times; Skip to main content Log in My EUR-Lex My EUR-Lex Sign in Register My recent searches (0) English English Select your language Official EU languages: bg бълг",
   "rationale": "Page is a navigational portal, homepage, or institution landing page rather than a specific regulatory document.",
   "confidence": 0.85,
   "classified_by": "session-haiku",
   "classified_at": "2026-09-04T19:26:12.340Z",
   "prompt_version": "sha256:70ca104246d8bb95"
  },
  {
   "candidate_id": "c182750e-d69f-4650-998f-45591526b55a",
   "url": "https://eur-lex.europa.eu/collection/eu-law/pre-acts.html",
   "entity_verdict": "portal",
   "item_type": null,
   "domain": null,
   "surface_tags": [],
   "relevance": null,
   "severity": null,
   "priority": null,
   "urgency_tier": null,
   "topic_tags": [],
   "jurisdictions": [],
   "title_candidate": "EUR-Lex",
   "summary": "Preparatory documents - EUR-Lex &times; Skip to main content Log in My EUR-Lex My EUR-Lex Sign in Register My recent searches (0) English English Select your language Official EU languages: bg българс",
   "rationale": "Page is a navigational portal, homepage, or institution landing page rather than a specific regulatory document.",
   "confidence": 0.85,
   "classified_by": "session-haiku",
   "classified_at": "2026-09-04T19:26:12.340Z",
   "prompt_version": "sha256:70ca104246d8bb95"
  },
  {
   "candidate_id": "442ebd19-dbdf-49d0-badf-e7b624436777",
   "url": "https://eur-lex.europa.eu/collection/eu-law/efta.html",
   "entity_verdict": "portal",
   "item_type": null,
   "domain": null,
   "surface_tags": [],
   "relevance": null,
   "severity": null,
   "priority": null,
   "urgency_tier": null,
   "topic_tags": [],
   "jurisdictions": [],
   "title_candidate": "EUR-Lex",
   "summary": "EFTA documents - EUR-Lex Official Journal of the European Union and related to the European Economic Area (EEA)\"/> &times; Skip to main content Log in My EUR-Lex My EUR-Lex Sign in Register My recent ",
   "rationale": "Page is a navigational portal, homepage, or institution landing page rather than a specific regulatory document.",
   "confidence": 0.85,
   "classified_by": "session-haiku",